{
  "schemaVersion": "1.0.0",
  "evaluatorVersion": "calibration-mutation-evaluator/0.1.0",
  "metricVersion": "calibration-mutation-metrics/1.0.0",
  "suiteId": "efforthours-public-synthetic-php-mutations",
  "suiteVersion": "0.1.0",
  "caseCount": 14,
  "assertionCount": 59,
  "passedCount": 59,
  "failedCount": 0,
  "allPassed": true,
  "ignoredCandidateCount": 0,
  "candidateEstimatorVersions": [
    "seed-rules/0.4.0"
  ],
  "cases": [
    {
      "caseId": "php-api",
      "candidateEstimatorVersion": "seed-rules/0.4.0",
      "candidateEstimateDigest": "sha256:d4064a40faf976b114532aa72a14a0a5dd597432d447d827b38a45b26c26705b",
      "totalHours": {
        "low": 6.25,
        "expected": 13.25,
        "high": 24.75
      }
    },
    {
      "caseId": "php-background",
      "candidateEstimatorVersion": "seed-rules/0.4.0",
      "candidateEstimateDigest": "sha256:d08d00ebd1a32485e006e87eb6c07ca3cb5ed0f18312d0681b6fbd5088d1e64c",
      "totalHours": {
        "low": 6.25,
        "expected": 13.00,
        "high": 24.25
      }
    },
    {
      "caseId": "php-base",
      "candidateEstimatorVersion": "seed-rules/0.4.0",
      "candidateEstimateDigest": "sha256:d5060b631b0319a73774778929a4a6fd9e9b78046c0e6a9a73c09dea16121158",
      "totalHours": {
        "low": 4.75,
        "expected": 8.75,
        "high": 16.00
      }
    },
    {
      "caseId": "php-data",
      "candidateEstimatorVersion": "seed-rules/0.4.0",
      "candidateEstimateDigest": "sha256:0784b6accdb1b49c45d342d0f41557adfc8e622639d632c25747d4ed5ca882a5",
      "totalHours": {
        "low": 7.25,
        "expected": 14.75,
        "high": 28.00
      }
    },
    {
      "caseId": "php-duplicate",
      "candidateEstimatorVersion": "seed-rules/0.4.0",
      "candidateEstimateDigest": "sha256:2ef5d474527a283842dfc4d28037fe076e8f303c83e84780a646a68bf53694dd",
      "totalHours": {
        "low": 4.75,
        "expected": 8.75,
        "high": 16.00
      }
    },
    {
      "caseId": "php-excluded",
      "candidateEstimatorVersion": "seed-rules/0.4.0",
      "candidateEstimateDigest": "sha256:f7059c1ca7209e161238de639bbe56a501c709530cca2907d2577b1bf278abed",
      "totalHours": {
        "low": 5.00,
        "expected": 9.25,
        "high": 16.75
      }
    },
    {
      "caseId": "php-formatting",
      "candidateEstimatorVersion": "seed-rules/0.4.0",
      "candidateEstimateDigest": "sha256:a969ac5eb494c564296c6d206b700b081c4dc94cbc5a1b31f3d255b7c063acf9",
      "totalHours": {
        "low": 4.75,
        "expected": 8.75,
        "high": 16.00
      }
    },
    {
      "caseId": "php-integration",
      "candidateEstimatorVersion": "seed-rules/0.4.0",
      "candidateEstimateDigest": "sha256:20662a95923893f7d236cb71df186d99f5320dbf998cfe66150e4543bdb6f7a1",
      "totalHours": {
        "low": 6.00,
        "expected": 13.00,
        "high": 24.75
      }
    },
    {
      "caseId": "php-security",
      "candidateEstimatorVersion": "seed-rules/0.4.0",
      "candidateEstimateDigest": "sha256:dec4830f2ac8c8e9a51f0a7e1b970646eab1bdebfaadf7b8776cbf68133b7b03",
      "totalHours": {
        "low": 6.50,
        "expected": 14.25,
        "high": 27.25
      }
    },
    {
      "caseId": "php-tests-system",
      "candidateEstimatorVersion": "seed-rules/0.4.0",
      "candidateEstimateDigest": "sha256:f1c1de184b416c25013caa4a5c2719e52bc78281a3b5c879b626abced34351bb",
      "totalHours": {
        "low": 9.00,
        "expected": 19.00,
        "high": 36.75
      }
    },
    {
      "caseId": "php-tests-unit",
      "candidateEstimatorVersion": "seed-rules/0.4.0",
      "candidateEstimateDigest": "sha256:0c3f4cc6e1812c9686b9521f5228c609069994b604cbb5daedd9fd51094976b7",
      "totalHours": {
        "low": 5.50,
        "expected": 9.75,
        "high": 17.50
      }
    },
    {
      "caseId": "php-ui",
      "candidateEstimatorVersion": "seed-rules/0.4.0",
      "candidateEstimateDigest": "sha256:2133ceffb39e1fecf406fac0d612690acc3e79ed24747d1d7cde3aed7d02ee8a",
      "totalHours": {
        "low": 7.00,
        "expected": 14.25,
        "high": 27.00
      }
    },
    {
      "caseId": "php-validation",
      "candidateEstimatorVersion": "seed-rules/0.4.0",
      "candidateEstimateDigest": "sha256:07f205b1a193d5aaa4713ea75637142182d7f0b5460285ace6182bb2386626fc",
      "totalHours": {
        "low": 5.00,
        "expected": 10.50,
        "high": 19.25
      }
    },
    {
      "caseId": "php-workspace",
      "candidateEstimatorVersion": "seed-rules/0.4.0",
      "candidateEstimateDigest": "sha256:6db6cf0547240dff998be702b6569c92c374f3bdca29a98b8cca03bd8e3146e4",
      "totalHours": {
        "low": 8.75,
        "expected": 16.00,
        "high": 28.50
      }
    }
  ],
  "assertions": [
    {
      "id": "php-api-expected",
      "family": "qualified-api-semantics",
      "subjectCaseId": "php-api",
      "referenceCaseId": "php-base",
      "point": "expected",
      "scope": "category",
      "category": "production-implementation",
      "subjectHours": 3.75,
      "referenceHours": 1.25,
      "differenceHours": 2.50,
      "minimumDifferenceHours": 2,
      "passed": true,
      "rationale": "An import-qualified route increases expected production EHE."
    },
    {
      "id": "php-api-high",
      "family": "qualified-api-semantics",
      "subjectCaseId": "php-api",
      "referenceCaseId": "php-base",
      "point": "high",
      "scope": "category",
      "category": "production-implementation",
      "subjectHours": 7.50,
      "referenceHours": 2.50,
      "differenceHours": 5.00,
      "minimumDifferenceHours": 4,
      "passed": true,
      "rationale": "An import-qualified route increases high production EHE."
    },
    {
      "id": "php-api-integration-isolation",
      "family": "category-isolation",
      "subjectCaseId": "php-api",
      "referenceCaseId": "php-base",
      "point": "expected",
      "scope": "category",
      "category": "external-integrations-and-protocols",
      "subjectHours": 0,
      "referenceHours": 0,
      "differenceHours": 0,
      "minimumDifferenceHours": 0,
      "maximumDifferenceHours": 0,
      "passed": true,
      "rationale": "A local HTTP route is not an outbound integration."
    },
    {
      "id": "php-api-low",
      "family": "qualified-api-semantics",
      "subjectCaseId": "php-api",
      "referenceCaseId": "php-base",
      "point": "low",
      "scope": "category",
      "category": "production-implementation",
      "subjectHours": 1.50,
      "referenceHours": 0.50,
      "differenceHours": 1.00,
      "minimumDifferenceHours": 0.75,
      "passed": true,
      "rationale": "An import-qualified route increases low production EHE."
    },
    {
      "id": "php-api-security-isolation",
      "family": "category-isolation",
      "subjectCaseId": "php-api",
      "referenceCaseId": "php-base",
      "point": "expected",
      "scope": "category",
      "category": "security-and-accessibility",
      "subjectHours": 0,
      "referenceHours": 0,
      "differenceHours": 0,
      "minimumDifferenceHours": 0,
      "maximumDifferenceHours": 0,
      "passed": true,
      "rationale": "A route alone does not invent security behavior."
    },
    {
      "id": "php-background-expected",
      "family": "qualified-background-semantics",
      "subjectCaseId": "php-background",
      "referenceCaseId": "php-base",
      "point": "expected",
      "scope": "category",
      "category": "production-implementation",
      "subjectHours": 3.25,
      "referenceHours": 1.25,
      "differenceHours": 2.00,
      "minimumDifferenceHours": 1.75,
      "passed": true,
      "rationale": "A queued job increases expected production EHE."
    },
    {
      "id": "php-background-high",
      "family": "qualified-background-semantics",
      "subjectCaseId": "php-background",
      "referenceCaseId": "php-base",
      "point": "high",
      "scope": "category",
      "category": "production-implementation",
      "subjectHours": 6.50,
      "referenceHours": 2.50,
      "differenceHours": 4.00,
      "minimumDifferenceHours": 3.5,
      "passed": true,
      "rationale": "A queued job increases high production EHE."
    },
    {
      "id": "php-background-low",
      "family": "qualified-background-semantics",
      "subjectCaseId": "php-background",
      "referenceCaseId": "php-base",
      "point": "low",
      "scope": "category",
      "category": "production-implementation",
      "subjectHours": 1.50,
      "referenceHours": 0.50,
      "differenceHours": 1.00,
      "minimumDifferenceHours": 0.75,
      "passed": true,
      "rationale": "A queued job increases low production EHE."
    },
    {
      "id": "php-background-security-isolation",
      "family": "category-isolation",
      "subjectCaseId": "php-background",
      "referenceCaseId": "php-base",
      "point": "expected",
      "scope": "category",
      "category": "security-and-accessibility",
      "subjectHours": 0,
      "referenceHours": 0,
      "differenceHours": 0,
      "minimumDifferenceHours": 0,
      "maximumDifferenceHours": 0,
      "passed": true,
      "rationale": "A job interface alone does not invent security behavior."
    },
    {
      "id": "php-data-expected",
      "family": "persistence-and-migration-semantics",
      "subjectCaseId": "php-data",
      "referenceCaseId": "php-base",
      "point": "expected",
      "scope": "category",
      "category": "data-modeling-persistence-and-migrations",
      "subjectHours": 3.25,
      "referenceHours": 0,
      "differenceHours": 3.25,
      "minimumDifferenceHours": 3,
      "passed": true,
      "rationale": "A model and migration increase expected data EHE."
    },
    {
      "id": "php-data-high",
      "family": "persistence-and-migration-semantics",
      "subjectCaseId": "php-data",
      "referenceCaseId": "php-base",
      "point": "high",
      "scope": "category",